{
  "event_id": "11111111-1111-4111-8111-111111111111",
  "event_type": "strength.session_completed.v1",
  "event_version": "v1",
  "subject_id": "00000000-0000-4000-8000-000000000001",
  "aggregate": {
    "type": "strength_session",
    "id": "22222222-2222-4222-8222-222222222222",
    "domain": "strength"
  },
  "mutation_id": "33333333-3333-4333-8333-333333333333",
  "actor": {
    "user_id": "00000000-0000-4000-8000-000000000001",
    "role": "athlete"
  },
  "source": {
    "app": "strength",
    "build": "0.1.0-canary",
    "client_schema_version": "shared-core-1.0.0-draft"
  },
  "observed_at": "2026-08-04T08:30:00+10:00",
  "recorded_at": "2026-08-04T08:31:00+10:00",
  "causation_id": null,
  "correlation_id": "44444444-4444-4444-8444-444444444444",
  "payload": {
    "session_kind": "strength",
    "completed_at": "2026-08-04T08:30:00+10:00",
    "result_snapshot_id": "55555555-5555-4555-8555-555555555555"
  },
  "provenance": {
    "provider": null,
    "provider_record_id": null,
    "raw_payload_hash": null
  }
}
